{
  "$schema": "http://json-schema.org/draft-07/schema#",
  "$id": "https://intrale.local/pipeline/contracts/project.schema.json",
  "title": "project descriptor - kernel multi-product manifest (Ola Puente P2 #4687)",
  "type": "object",
  "additionalProperties": false,
  "required": ["schemaVersion", "identity", "repositories", "board", "capabilities", "authority"],
  "properties": {
    "schemaVersion": {
      "type": "string",
      "pattern": "^1\\.1$"
    },
    "status": {
      "type": "string",
      "enum": ["onboarding", "active", "archived"]
    },
    "integrity": {
      "type": "object",
      "additionalProperties": false,
      "required": ["algorithm", "checksum"],
      "properties": {
        "algorithm": { "type": "string", "enum": ["sha256"] },
        "checksum": { "type": "string", "pattern": "^[a-f0-9]{64}$" }
      }
    },
    "identity": {
      "type": "object",
      "additionalProperties": false,
      "required": ["projectId", "name"],
      "properties": {
        "projectId": {
          "type": "string",
          "pattern": "^[a-z0-9][a-z0-9-]{1,63}$"
        },
        "name": { "type": "string", "minLength": 1, "maxLength": 200 },
        "description": { "type": "string", "maxLength": 2000 }
      }
    },
    "repositories": {
      "type": "array",
      "minItems": 1,
      "uniqueItems": true,
      "items": {
        "type": "object",
        "additionalProperties": false,
        "required": ["id"],
        "properties": {
          "id": {
            "type": "string",
            "pattern": "^[a-z0-9][a-z0-9-]{1,63}$"
          },
          "url": { "type": "string", "minLength": 1, "maxLength": 300 },
          "role": { "type": "string", "enum": ["primary", "secondary"] },
          "defaultBaseRef": { "type": "string", "minLength": 1, "maxLength": 100 },
          "alternateBaseRef": { "type": "string", "minLength": 1, "maxLength": 100 },
          "provenance": { "type": "string", "enum": ["existing", "create"] },
          "create": {
            "type": "object",
            "additionalProperties": false,
            "required": ["name"],
            "properties": {
              "name": { "type": "string", "pattern": "^[A-Za-z0-9._-]{1,100}$" },
              "org": { "type": "string", "minLength": 1, "maxLength": 100 },
              "visibility": { "type": "string", "enum": ["private", "public"] }
            }
          }
        },
        "allOf": [
          {
            "if": {
              "required": ["provenance"],
              "properties": { "provenance": { "const": "create" } }
            },
            "then": {
              "required": ["create"],
              "not": { "required": ["url"] }
            },
            "else": {
              "required": ["url"]
            }
          }
        ]
      }
    },
    "providers": {
      "type": "object",
      "additionalProperties": false,
      "required": ["order"],
      "properties": {
        "order": {
          "type": "array",
          "minItems": 1,
          "maxItems": 3,
          "uniqueItems": true,
          "items": {
            "type": "string",
            "enum": ["anthropic", "openai-codex", "antigravity"]
          }
        }
      }
    },
    "pullRequests": {
      "type": "object",
      "additionalProperties": false,
      "required": ["policy"],
      "properties": {
        "policy": { "type": "string", "enum": ["required", "direct-to-main"] }
      }
    },
    "board": {
      "type": "object",
      "additionalProperties": false,
      "required": ["ref", "admissionLabels", "routing"],
      "properties": {
        "ref": { "type": "string", "minLength": 1, "maxLength": 300 },
        "admissionLabels": {
          "type": "array",
          "minItems": 1,
          "uniqueItems": true,
          "items": { "type": "string", "minLength": 1, "maxLength": 100 }
        },
        "routing": {
          "type": "array",
          "items": {
            "type": "object",
            "additionalProperties": false,
            "required": ["label", "capability"],
            "properties": {
              "label": { "type": "string", "minLength": 1, "maxLength": 100 },
              "capability": {
                "type": "string",
                "enum": ["backend", "frontend", "pipeline", "generic"]
              }
            }
          }
        }
      }
    },
    "credentials": {
      "type": "array",
      "uniqueItems": true,
      "items": {
        "type": "object",
        "additionalProperties": false,
        "required": ["ref", "scopes"],
        "properties": {
          "ref": {
            "type": "string",
            "pattern": "^~?[A-Za-z0-9._/-]+#[A-Za-z0-9._:-]+$"
          },
          "scopes": {
            "type": "array",
            "minItems": 1,
            "uniqueItems": true,
            "items": {
              "type": "string",
              "enum": [
                "aws",
                "github",
                "google_drive",
                "multimedia",
                "providers:anthropic",
                "providers:openai",
                "r2",
                "telegram"
              ]
            }
          },
          "inherit": {
            "type": "array",
            "uniqueItems": true,
            "items": {
              "type": "string",
              "enum": [
                "aws",
                "github",
                "google_drive",
                "multimedia",
                "providers:anthropic",
                "providers:openai",
                "r2",
                "telegram"
              ]
            }
          },
          "shared": {
            "type": "array",
            "uniqueItems": true,
            "items": {
              "type": "string",
              "enum": [
                "aws",
                "github",
                "google_drive",
                "multimedia",
                "providers:anthropic",
                "providers:openai",
                "r2",
                "telegram"
              ]
            }
          }
        }
      }
    },
    "capabilities": {
      "type": "array",
      "minItems": 1,
      "uniqueItems": true,
      "items": {
        "type": "object",
        "additionalProperties": false,
        "required": ["interface", "skills"],
        "properties": {
          "interface": {
            "type": "string",
            "enum": ["backend", "frontend", "pipeline", "generic"]
          },
          "skills": {
            "type": "array",
            "minItems": 1,
            "uniqueItems": true,
            "items": { "type": "string", "minLength": 1, "maxLength": 64 }
          }
        }
      }
    },
    "authority": {
      "type": "object",
      "additionalProperties": false,
      "required": ["signers", "gates"],
      "properties": {
        "signers": {
          "type": "array",
          "minItems": 1,
          "uniqueItems": true,
          "items": {
            "type": "string",
            "pattern": "^[A-Za-z0-9][A-Za-z0-9-]{0,38}$"
          }
        },
        "backup": {
          "type": "string",
          "pattern": "^[A-Za-z0-9][A-Za-z0-9-]{0,38}$"
        },
        "gates": {
          "type": "object",
          "additionalProperties": false,
          "properties": {
            "gate0": { "type": "string", "maxLength": 32 },
            "gate2": { "type": "string", "maxLength": 32 },
            "visual": { "type": "string", "maxLength": 32 }
          }
        }
      }
    },
    "thresholds": {
      "type": "object",
      "additionalProperties": false,
      "properties": {
        "concurrency": {
          "type": "object",
          "additionalProperties": { "type": "integer", "minimum": 0, "maximum": 100 }
        },
        "priorityWindows": {
          "type": "object",
          "additionalProperties": false,
          "properties": {
            "activationThreshold": { "type": "integer", "minimum": 1, "maximum": 1000 },
            "safetyTimeoutHours": { "type": "number", "minimum": 0, "maximum": 720 }
          }
        },
        "providerQuotas": {
          "type": "object",
          "additionalProperties": { "type": "number", "minimum": 0, "maximum": 100 }
        },
        "globalAgentCap": {
          "type": "integer",
          "minimum": 1,
          "maximum": 100
        },
        "agentCap": {
          "type": "integer",
          "minimum": 0,
          "maximum": 100
        },
        "minAgentFloor": {
          "type": "integer",
          "minimum": 0,
          "maximum": 100
        },
        "providerBudget": {
          "type": "object",
          "additionalProperties": { "type": "number", "minimum": 0, "maximum": 100 }
        },
        "worktreeRoot": {
          "type": "string",
          "minLength": 1,
          "maxLength": 300
        },
        "degradedMode": {
          "type": "object",
          "additionalProperties": false,
          "properties": {
            "strategy": { "type": "string", "enum": ["enqueue", "reject"] }
          }
        }
      }
    },
    "kernel": {
      "type": "object",
      "additionalProperties": false,
      "properties": {
        "version": {
          "type": "string",
          "pattern": "^\\d+\\.\\d+\\.\\d+$"
        },
        "channel": {
          "type": "string",
          "enum": ["stable", "canary"]
        }
      }
    }
  }
}
